"name";"website";"phone";"address";"city";"state";"zip";"stars";"country";"details";"logo_url";"kids_program_url";"kids_program_detail";"woman_only_program_url";"woman_only_program_detail";"other_programs";"pricing";"schedule_url";"business_hour";"head_professor";"special_offer";"email";"facebook_url";"youtube_channel";"video_url";"awards";"multiple_locations (0=Yes, 1=No)";"id";"NOTES"
"New Breed Training Center";"https://www.newbreedtrainingcenter.com/";(847) 674-3577;"5647 West Howard St";"Niles";"IL";60714;;"United States";"Established in November 2004, new breed training center initially started out as just a group of friends with one simple mission statement. Our goal was to be able to bring together a group of friends and change the way we trained.  We loved brazilian jiu-jitsu and wanted an open environment in which everyone had a voice and everyone was able to contribute - as a result, New Breed Training Center was born. We quickly became one of the most prominent Brazilian Jiu-Jitsu Teams in the Chicagoland Area and in the Midwest, winning 3-consecutive North American Grappling Association (NAGA) Team Titles, A Titan Grappling Championship Team Title, and producing many individual accolades. After making our mark on the Midwest/Regional Scene, our Brazilian Jiu-Jitsu Team set their sites on the international circuit and has since produced a countless number of International Brazilian Jiu-Jitsu Federation (IBJJF) champions, Abu Dhabi World Pro Champions, Mixed Martial Art Competitors, and so much more!!! Eventually, we moved from our modest roots in Evanston and Skokie to our current Niles facility in January 2011.  Throughout the years, we have become more than just a Brazilian Jiu-Jitsu Team. We’ve become a family. We believe that in order to best achieve everyone’s goals, the most important component is your training environment.We have always dedicated our efforts into maintaining the quality of the environment in which all of our members train; ensuring that everyone “gets better together.” New Breed Training Center is the culmination of what has been years of dedication, hard work, and friendship. We are happy and honored to share what we’ve learned with you.";"https://static.wixstatic.com/media/0b9fcd_c770b1781f394bb78b7ad99e2c5f9c9a~mv2.png/v1/crop/x_9,y_0,w_758,h_797/fill/w_214,h_224,al_c,q_80,usm_0.66_1.00_0.01/newbreedlogo.webp";"https://www.newbreedtrainingcenter.com/programs";"Our Kids’ Brazilian Jiu-Jitsu program is designed to challenge your children to utilize and develop both their bodies and minds. your children will learn fundamental movements, concepts, and condition their bodies to prepare them for their time to join up with the adult Brazilian Jiu-Jitsu programs. Our goal is for each child to “want” to come to Brazilian Jiu-Jitsu and make training part of their daily routine so that when they grow older, they will continue to develop and flourish in the martial art. Kids’ Brazilian Jiu-Jitsu classes are held 6-days per week and have a curriculum which will continually reinforce good technique while developing their abilities.";;;"Muay Thai Kickboxing, MMA, Boxing";;"https://www.newbreedtrainingcenter.com/schedule";"Mon-Thurs: 9:30am-1:30pm, 4:00pm-9:30pm, Fri: 10:00am-1:30pm, 5:00pm-7:00pm, Sat: 9:00am-1:30pm, Sun: 10:30am-12:00pm";"Mark Vives";"Free Week Of Classes";;"https://www.facebook.com/newbreedtrainingcenter";"https://www.youtube.com/user/nbjjchicago";;;1;;
"Bodhi Collaborative Brazilian Jiu Jitsu";"http://www.bodhicollaborative.com/";(331) 330-0662;"2081 63rd St.​";"Downers Grove";"IL";60516;;"United States";"Bodhi Collaborative is the Brazilian Jiu Jitsu program at CounterStrike MMA Academy in Downers Grove, Illinois. We are affiliated with IBJJF third-degree black belt Jonatas Novaes. Our goal is to develop well-rounded jiu jitsu practitioners whether they’re looking to compete, stay in shape, or learn self-defense. Classes are taught in a safe, family friendly environment by instructors who are dedicated to giving individualized attention to students. The unique curriculum allows for easy learning for beginners, while providing challenges to advanced students through the constant exploration of techniques and concepts.";"http://www.bodhicollaborative.com/uploads/4/7/8/9/47898109/editor/bodhi-shirt-back_2.jpg?1543614767";;;;;;"Membership rates are fully customizable for your training needs and goals. We provide affordable options for part time jiu jitsu practitioners starting at just $90 per month, to packages for those that want to train in multiple martial arts. Family rates are also available. ";"http://www.bodhicollaborative.com/classes--pricing.html";;"Tristan Espiritu";"FREE intro week";"bodhi.collaborative@gmail.com";"https://www.facebook.com/bodhi.collaborative/";;;;1;;
"Lake County Brazilian Jiu-Jitsu";"https://www.lakecountybjj.com/";(847) 495-2557;"370 Townline Rd";"Mundelein";"IL";60060;;"United States";"We are Lake County’s premier Brazilian Jiu-Jitsu academy. We offer the most classes in Adult Brazilian Jiu-Jitsu and children’s Brazilian Jiu-Jitsu in Lake County. Our classes are designed to teach you self defense, get a great workout, and learn a new sport all while having fun. We offer kids' classes for ages 5 and up. We are a proud affiliate of Checkmat Brazilian Jiu-Jitsu family. We are excited to bring our brand of BJJ to the Lake County area.";"https://www.lakecountybjj.com/wp-content/uploads/2018/01/logo.png";"https://www.lakecountybjj.com/program/kids-martial-arts/";"When kids respect themselves, they also learn to respect others. The pursuit of regular, small goals helps kids learn the benefits of discipline. Kids learn to work through mistakes and disappointments without losing control. Our instruction inside our martial arts school translate to greater discipline in any situation.";;;;;;"Mon: 10:00am-9:00pm; Tues, Thurs: 6:00am-9:00pm; Wed: 5:00pm-9:00pm; Fri: 10:00am-8:00pm; Sat: 9:30am-11:30am";"Carlos Archila";;"info@lakecountybjj.com";"https://www.facebook.com/lakecountybjj";"https://www.youtube.com/channel/UCeZueeOWNcLSDnREWR-wflg";"https://youtu.be/YMexqQO3pFA";;1;;
"Olympus Jiu-Jitsu";"http://www.olympusjj.com/";(630) 797-0816;"1501 Indiana Ave, Unit 1A";"Saint Charles";"IL";60174;;"United States";;;"http://www.olympusjj.com/kids-jiu-jitsu.html";"Give your kids a solid self-defense foundation that will carry over into their daily lives and other activities. These classes are fun and full of action to help your children prevent and overcome bullying, stranger danger, increase fitness levels and coordination skills, help them to mentally focus, instill strong confidence in themselves, respect for others and self-discipline.";;;;;"http://www.olympusjj.com/class-schedule.html";;;"FREE Jiu-Jitsu & Striking Trial Class";"olympusjj@yahoo.com";"https://www.facebook.com/olympusjj";"https://www.youtube.com/channel/UCDL5fShYYM2dUx70EBJWrmA/";"https://youtu.be/V0q1W1GfZeI";;1;;
"Mission MMA and Fitness";"http://missionmmachicago.com/";(312) 265-1856;"1620 W Carroll Ave";"Chicago";"IL";60612;;"United States";"Learn from the best Mixed Martial Arts instructors in the area who are dedicated to providing a stable, family environment where you can excel in your personal goals and find a varied and supportive community. Whether your plan is to compete, lose weight, meet new like-minded people or increase your day-to-day life, we will help you get there faster than you ever thought possible while having fun doing it! The benefits of Mixed Marital Arts classes are endless. From confidence and self-esteem to discipline and empowerment, whether you're enjoying our Muay Thai Kickboxing classes or our Fitness programs, you'll start seeing improvement in mind, body and spirit in only a few short classes.";"https://res.cloudinary.com/display97/image/upload/q_auto,fl_lossy,f_auto/ri4pdwmtesmifw7nlmh7.png";"http://missionmmachicago.com/classes/Kids-Self-Defense";"Kids Self Defense classes provide a safe, active atmosphere where kids can release some energy and have fun. Under professional guidance, your young athlete will learn more than just martial arts - and have a lot of fun doing it! We teach Kids Self Defense using tested and efficient real world applications that give kids the martial arts techniques and knowledge they need to protect themselves in various circumstances. Learning evasion techniques, peaceful confrontation management, and effective self defense techniques in this course will instill a sense of confidence within your child. Our devoted instructors will reinforce the important life skills of confidence, discipline, hard work, team work, and most importantly respect.";"http://missionmmachicago.com/classes/Women's-Brazilian-Jiu-Jitsu";"At Mission MMA in Chicago our Women’s Brazilian Jiu Jitsu (BJJ) program is structured to achieve maximum comfort for females interested in pursuing Brazilian Jiu-Jitsu. This class offers a relaxed and non-threatening environment for all women. Never been to a martial arts class before? No problem, we welcome and encourage beginner students to attend. In our Women’s Brazilian Jiu Jitsu classes you will learn top notch self defense techniques while getting into superior shape. We promise that you will grow stronger and learn these methods quickly under the guidance of experienced and accomplished female instructors. ";"Muay Thai Kickboxing, Fitness";;"http://missionmmachicago.com/blog/57399/Schedule";;"Said Hatim";;"info@missionmmachicago.com";"https://www.facebook.com/MissionMMAchicago";"https://www.youtube.com/channel/UCfPaDzFvM5dpNllcSno5LXg";"https://youtu.be/_QzVgZbFPDg";;1;;
"ROL Academy of Jiu Jitsu";"https://www.rolacademy.com/";(708) 682-6262;"15629 S 71st Ct.";"Orland Park";"IL";60462;;"United States";"Professor Thomas began his Brazilian Jiu Jitsu journey in 2000 under the watchful eye of the late Grandmaster Carlson Gracie Sr. in Chicago. In 2014, Professor Thomas was promoted to First Degree by Professor Eddie Redzovic and Grandmaster Carley Gracie. Shortly after, he decided to continue promoting the Jiu Jitsu lifestyle by relaying his knowledge and experience to others. That’s when the idea of ROL Academy of Jiu Jitsu was born. In 2015, his long-time dream finally came true: ROL Academy of Jiu Jitsu opened its doors to the public in Orland Park, Illinois. In 2017, Professor Thomas was promoted to Second Degree by Professor Eddie Redzovic and Grandmaster Carley Gracie.";"https://static.wixstatic.com/media/874ad8_b91dfb69df214049af29458cddaf1453~mv2.png/v1/fill/w_84,h_78,al_c,q_80,usm_0.66_1.00_0.01/ROL-circle-logo-1.webp";;"ROL Academy Kids Program has been created to allow your child to get introduced to the art of Brazilian Jiu Jitsu. Classes include games, activities, techniques, physical drills, and live training.";;;;;;;"Thomas Rozdzynski";;;"https://www.facebook.com/rolacademy";"https://www.youtube.com/channel/UC8pfXsQeE20xqIrQKTUj5Pw";"https://youtu.be/uUdZFpUHDwA";;1;;
"MBD Martial Arts Academy";"http://www.mbdmartialarts.com/";(847) 297-2788;"1508 Miner St.";"Des Plaines";"IL";60016;;"United States";"At MBD Martial Arts Academy we teach traditional karate as well as realistic self defense - no matter what your starting level is you'll benefit from moving your body in fun new ways, leaing amazing life saving skills, and becoming part of a close knit martial arts community!";"http://www.mbdmartialarts.com/assets/school/1099/logo.png";"http://www.mbdmartialarts.com/klma";"Amazing! MBD Martial Arts Academy Program Not Only Teaches Kids Self-Defense… But Gives Them The Tools They Need For Success In Life…From focusing, to goal setting, to self-discipline, to self-respect – kids emerge from this program changed for the better. And their parents couldn't be happier. ";;;"Krav Maga, Kickboxing, Summer Camp For Kids";;;;"Michelle DeLaRosa";;;"https://www.facebook.com/mbdmartialarts/";"https://www.youtube.com/channel/UCuT_qCa-G56GV58wiZtccLw";"https://youtu.be/F8OLk9wj4i4";;1;;
"Gracie Barra Champaign";"http://www.gbchampaign.com/";(217) 302-6126;"408 N Race St., Ste E";"Urbana";"IL";61801;;"United States";"Gracie Barra Champaign offers Brazilian Jiu-Jitsu classes with top quality instruction to meet the needs of its students – whether it is to get in better shape, learn Jiu-Jitsu for sport or for self-defense. Gracie Barra Champaign offers classes for all ages and skill levels. In addition to learning the art of BJJ, emphasis is placed on fostering a team and family dynamic among students and instructors. All members become part of the Gracie Barra family and are treated with respect, regardless of belt rank or experience level. At GB Champaign, students are the number one priority. Our instructors have dedicated their lives to the martial arts, and strive to make each training experience one to remember by inspiring their students to live the Brazilian Jiu-Jitsu lifestyle. The Gracie Barra family is a global organization formed by more than 500 schools worldwide. School owners work together to ensure that classes are aligned with the Gracie Barra Program Structure developed by Master Carlos Gracie Jr. to meet the needs of students of different ages, gender and levels. In addition to BJJ, Gracie Barra Champaign offers Commando Krav Maga classes.  Commando Krav Maga is the ultimate Israeli reality based street self-defense system. CKM was designed to teach students to protect themselves against brutal and vicious street confrontations by using no-nonsense, efficient, straight forward moves. Whether you want to learn self-defense, ground fighting, or just get in amazing shape, there is a place for you at Gracie Barra Champaign!";"http://www.gbchampaign.com/uploads/7/8/1/6/78164848/1-gb.jpg";"http://www.gbchampaign.com/childrens-program.html";"To excel in any endeavor, individuals need to have a strong set of values and a solid character that gives them perseverance to achieve his or her goals. The Gracie Barra Future Champions Program was created to provide children ages 6-12 with an environment that allows them to experience and understand core values like focus, discipline, persistence, cooperation and respect.";;;"Commando Krav Maga & Muay Thai, Barra FIT & Muay Thai";;;;"Josh Cadenbach";;"info@gbchampaign.com";"https://www.facebook.com/gbchampaign/";"https://www.youtube.com/channel/UCtLlyoABhKwBiVc6IuHEB9A";"https://youtu.be/e0ZDcn4TG50";;1;;
"Staley Martial Arts";"https://www.staleymartialarts.com/";(847) 905-0264;"123 Green Bay Rd";"Wilmette";"IL";60091;;"United States";"Staley Martial Arts is a family oriented Brazilian Jiu-Jitsu and Self Defense school located in Wilmette that embraces and teaches the traditional values of martial arts rather than the popular trend of an MMA gym. We strive to give back to the community and help students to progress and evolve throughout their education competitively, personally and in all pertinent areas of their lives. We offer group and individual classes for students of all ages and skill levels in Jiu-Jitsu and self defense. Our youngest student is 18 months and our oldest student is 71 years old.";"https://static.wixstatic.com/media/3fc5e1_a576dee241bb45c9b9818aeac3f079e3~mv2.png/v1/fill/w_70,h_85,al_c,q_80,usm_0.66_1.00_0.01/3fc5e1_a576dee241bb45c9b9818aeac3f079e3~mv2.webp";;;;;"Taekwondo, Self Defense";;"https://www.staleymartialarts.com/schedule";;"Gustavo Rudel";;"info@staleymartialarts.com";"https://www.facebook.com/staleymartialarts/";;;;1;;
"Team Curran MMA";"https://teamcurran.com/";(815) 356-0454;"456 South Dartmoor Dr";"Crystal Lake";"IL";60014;;"United States";"We take pride in our motto, “Passion, Persistence, Perfection!” As Jeff Curran always says, it takes Passion form something challenging in life in order to be Persistent towards your goals of being Perfect in what you do.";"https://teamcurran.com/wp-content/uploads/2014/11/weblogo.png";"https://teamcurran.com/kids-programs/";"Since most actual altercations end up on the ground, our Kids Jiu-Jitsu program prepares children to effectively defend themselves against the most difficult self-defense situations. The Junior Total Defense Program focuses on the physical and mental aspects of the student’s training. Our classes promote confidence and self-esteem, encourage social relationships, and enhance your child’s physical well-being by laying a foundation that stresses the importance of exercise and self-motivation. Does your child have the heart of a Little Champion? Come and join us for an exciting class for children ages 5/6 yrs old! Little Champions will offer your child a basic skill set to better prepare him or her for our kids’ martial arts programs.";;;"Muay Thai Boxing & Striking";"Unlimited Youth Training $150 per month; Unlimited Adult Training $150 per month; Lil Champs (5-6 yrs) $95 per month; Fitness $25 per month; Daily fees $25 per day. Current Law Enforcement/Fire Dept receives 25% Discount. Active Military receive 25% Discount";"https://teamcurran.com/schedule/";"Mon-Fri: 10:00am-9:00pm, Sat: 9:00am-3:00pm, Sun: Appointment Only";"Jeff “Big Frog” Curran";"The 2 Week Trial is designed to get you started in our programs as quickly as possible.  It will give you unlimited use of the facility as well as access to all classes available at your experience level.  There is no obligation to continue and if you decide to enroll before the end of the trial you can apply the $19.99 towards your first month of training. ";;"https://www.facebook.com/teamcurranmma";"https://www.youtube.com/user/TeamCurranMMA";"https://youtu.be/YS1Xq_Kt1t4";;1;;
"John Geyston's Martial Arts Academy";"https://www.jgpma.com/";(217) 546-6762;"1929 W Iles";"Springfield";"IL";62704;;"United States";"John Geyston's Martial Arts Academy began serving the Springfield Illinois community in quality martial arts in 1982. We provide Mixed Martial Arts, Muay Thai Kickboxing, Brazilian Jiu Jitsu, Fitness Kickboxing, Karate and Self-Defense classes for children, teens and adults. John Geyston's vision with his schools was and still is to build a community by helping people get in shape, be safe and at the same time instill the life skills and character of a true martial artist. Upholding important values like courtesy, patience, respect, self control and integrity.";"https://www.jgpma.com/wp-content/uploads/2017/12/springfield-martial-arts.png";"https://www.jgpma.com/program/kids-martial-arts/";"When kids respect themselves, they also learn to respect others. The pursuit of regular, small goals helps kids learn the benefits of discipline. Kids learn to work through mistakes and disappointments without losing control. Our instruction inside our martial arts school translate to greater discipline in any situation.";;;"MMA, Muay Thai Kickboxing, Fitness Kickboxing, Karate, Self-Defense";;;"Mon-Thurs: 10:00am-8:00pm, Sat: 8:00am-1:00pm";;;"jgpma@jgpma.com";"https://www.facebook.com/JGMAA/";"https://www.youtube.com/user/JGMAASpringfield";"https://youtu.be/WcDxcq8GQY4";;1;;
"APEX House of Grappling";"https://apexgrappling.com/";(773) 707-5191;"51 E. Plainfield Road";"Countryside";"IL";60525;;"United States";"At APEX House of Grappling, starting your Brazilian Jiu Jitsu journey, or continuing your already established BJJ life, is effortless.  We are conveniently located in Countryside, Illinois (just outside of Chicago) and offer a number of class times throughout the week and weekend for your scheduling convenience.  Private lessons with World Class instructors are also an option and will be set around your busy schedule. We also are only feet away from a fully-equipment fitness gym, called The Functional Athlete, with state of the art equipment and trainers.  APEX House of Grappling is the ultimate 'one-stop' fitness facility.";"https://img1.wsimg.com/isteam/ip/106bd877-73f0-44a0-afc4-b8004e72658c/logo/3b089bc1-be7a-4838-b3f0-804c52f2713d.PNG/:/rs=h:175/qt=q:95";;;;;;;"https://img1.wsimg.com/blobby/go/106bd877-73f0-44a0-afc4-b8004e72658c/downloads/apex%20schedule%20.pdf";;"Nick Spacek";"1 Hour Free";;"https://www.facebook.com/APEXHOG/";;;;1;;
"Powersource Martial Arts";"https://www.powersourcema.com/";(708) 960-4913;"17851 Bretz Dr";"Homewood";"IL";60430;;"United States";"In our schools, we believe it takes time, commitment, knowledge and real skills for a student to hold a belt ranking. We are not in the business of selling belts, there are no kids black belts in our schools, no belt testing fees, and belt promotions only happens twice a year. REAL SKILLS! REAL EXPECTATION!";;"https://www.powersourcema.com/kids-martial-arts-homewood-il.html";"As parents, we all know that children must to understand that everything that worth something in life requires time, hard work, dedication, determination, honesty and that is characterized as a discipline of the mind and body. Everything else will follow into place once the child understands this concept. I am pleased to hear from parents how our program has affected positively their children's life. In our children's program, we created an exclusive system to improve the children's perception of life's rewards and consequences. This system is directly related to how each child behaves in class and outside of Power Source.";;;"Judo, MMA, Kickboxing, Nonclassical Kung Fu";;;;"Andre Campos";;"powersourcemartialarts@gmail.com";"https://www.facebook.com/PowerSource-Martial-Arts-136093716824/";;;;1;;
"University Of Ground Fighting ";"https://www.uofgf.com/";(815) 529-4672;"12540 Harvey Dr";"New Lenox";"IL";60451;;"United States";"University of Ground Fighting's main focus is to teach and train anyone who is willing to learn in a fun, safe, and energetic atmosphere! UofGF is a Brazilian Jiu Jitsu academy that also focuses on Judo, Wrestling.";;"https://www.uofgf.com/SocialSite/kids";"Bring out the best in your children with the help of University Of Ground Fighting. We offer Kids classes to teach them the importance of self-defence. Enroll your children in our classes and discover the benefits of our children's programs: grade improvement, self confidence and self esteem. University Of Ground Fighting believes that every child is a born winner. Learning Brazilian Jiu-Jitsu Programs is an opportunity for your children to enhance real-life skills. Values like discipline, respect and optimism can be nurtured as well. More than that, martial arts classes is a great way to stay fit. ";;;"Judo, Wrestling";;"https://www.uofgf.com/SocialSite/schedule";;"Steven Patterson";;"stevenjpatterson@gmail.com";"https://www.facebook.com/UofGF";;;;1;;
"Uflacker Academy";"https://bjjsouthside.com/";(312) 890-3675;"6390 South Archer";"Chicago";"IL";60638;;"United States";"At Uflacker Academy we offer a friendly environment and authentic Brazilian Jiu Jitsu (Gracie Jiu Jitsu) instruction. What sets us apart is our head instructor, Professor Christian Uflacker, a world-class competitor, who has a keen ability to simplify the study of self-defense and brings a fresh approach to teaching. As a student, you will learn highly effective self-defense techniques and Brazilian Jiu-Jitsu, improve in your level of fitness, skill and self-confidence.";"https://bjjsouthside.com/wp-content/themes/uflacker/img/ufflacker-logo_2x.png";"https://bjjsouthside.com/program_group/kids-brazilian-jiu-jitsu-program/";"Classes are taught in a simple and structured manner so that EVERYONE can participate, learn and see the results! We offer fun and instructional classes for kids that integrate self-defense techniques with conditioning and skill oriented games, aimed at improving your child’s coordination, motor skills, agility and flexibility.";;;;;"https://bjjsouthside.com/schedule/";;"Christian Uflacker";"Free Trial Class";;"https://www.facebook.com/UflackerAcademy/";"https://www.youtube.com/channel/UCFkkOzTqypWs58ptEXZ4yog";"https://youtu.be/BlYAuXm5s00";;1;;
"Top Level MMA";"https://www.toplevelmma.com/";(847) 423-2918;"7038 Milwaukee Ave";"Niles";"IL";60714;;"United States";"TOP LEVEL MMA offers training in a wide variety of disciplines which is known as mixed martial arts (MMA). We specialize in Brazilian Jiu-Jitsu, Muay Thai, Krav Maga, Wrestling, Boxing and Yoga.";"https://www.toplevelmma.com/img/toplevel_logo_final.png";;;;;"Muay Thai, Krav Maga, Wrestling, Boxing, Yoga";;"https://www.toplevelmma.com/schedule/index.html";;"Paul Ambubuyog";;"info@toplevelmma.com";"https://www.facebook.com/TOPLEVELMMA/";"https://www.youtube.com/channel/UCSJaaJPwfkjCNhgjDIRN--g";"https://youtu.be/kDawM3GJHJM";;1;;
