"name";"website";"phone";"address";"city";"state";"zip";"stars";"country";"details";"logo_url";"kids_program_url";"kids_program_detail";"woman_only_program_url";"woman_only_program_detail";"other_programs";"pricing";"schedule_url";"business_hour";"head_professor";"special_offer";"email";"facebook_url";"youtube_channel";"video_url";"awards";"multiple_locations (0=Yes, 1=No)";"id";"NOTES"
"Indiana Brazilian Jiu-Jitsu Academy";"https://www.ibjja.com/";(317) 946-9447;"1140 N State Rd 135, Suite P";"Greenwood";"IN";46142;"5/5 Stars";"United States";"Here at IBJJA we have the most qualified instructors to teach all of these practical arts! There is no hype here! only REAL Martial arts that works in the REAL word and we have REAL results. We have programs that are made for everyone! The goal of the IBJJA is to promote athleticism, health, self-control and discipline, while providing he most advanced training for self-defense and sport competition.";"https://www.ibjja.com/wp-content/uploads/2017/02/IBJJA-Indiana-Brazilian-Jiu-Jitsu-Academy-logo-06-01.png";"https://www.ibjja.com/kids-mixed-martial-arts-in-indianapolis-indiana/";"Kids Mixed Martial Arts in Indianapolis Indiana! Fight Hub Headquarters is the ONLY place for Kids Mixed Martial Arts in Indianapolis! The popularity of Martial Arts will never diminish, may be it will change some of its form in the coming times. The Traditional Martial Arts have paved way for Mixed Martial Art and the kids are the most fascinated lot. After watching The Karate Kid, many kids have started dreaming to be one! Believe me there is nothing wrong in it and as a parent you should encourage the kid to be a martial artist. There are many benefits for kids’ training in Mixed Martial Arts (MMA). The Fight Hub HQ is the ONLY Academy in Central Indiana to offer Kids Mixed Martial Arts classes.";;;"Kickboxing, MMA";;"https://www.ibjja.com/schedule/";;"James Clingerman";"30 days free trial offer!";"james@ibjja.com";"https://www.facebook.com/IndianaBrazilianJiuJitsuAcademy/";;"https://youtu.be/IP2HCwc8ViQ";;1;635;
"Carlson Gracie Indianapolis Jiu Jitsu";"http://www.carlsongracieindy.com/";(317) 979-4466;"916 E Main St #111";"Greenwood";"IN";46143;"5/5 Stars";"United States";"We are here to help you reach your goals. We offer Brazilian Jiu Jitsu classes for everyone, including men, women, and children – fitness through martial arts and self-defense for the whole family. Whether you want to learn self-defense, dream of competition, need a way to relieve life’s stresses, or just want to get an amazing workout without having to mess around with machines, we have what you are looking for. Our school is sought out by those in the know for specific and hands on training. You always get Black Belt instruction and great student/instructor interaction. This is what makes Carlson Gracie Indianapolis Jiu Jitsu second to none! Brazilian Jiu Jitsu helps the casual student to develop flexibility, increase motor coordination and cardiovascular endurance, and a obtain a greater understanding of one’s fitness. With the fun and engaging training at Carlson Gracie Indianapolis Jiu Jitsu you will get all that and more! School owner and instructor, Alan Stockman, began training Brazilian Jiu Jitsu in 1997 while living in Fortaleza, Brazil.  He traveled extensively throughout Brazil, training and competing in the cities of Fortaleza, Teresina, Natal, Recife, Rio de Janeiro, Sao Paulo, and Porto Alegre. This is where the foundation of his game began. After arriving back in the States he continued training BJJ all over the US, earning his Black Belt after 13 ½ years of hard but rewarding work.  In this time he also successfully competed in BJJ Gi and No Gi tournaments and MMA.  He was one of the founders of the Michiana Fight League (MFL) in South Bend, Indiana, where he co-promoted over 2 dozen mixed martial arts shows.  He was the primary matchmaker for these and assisted matchmaking with many other Midwest promotions as well.  Alan worked closely with fighters from the Bulldog Fight Team, based out of Osceola, Indiana, helping to manage fighters and to promote their careers, seeing 2 of them eventually reach the Ultimate Fighting Championship (UFC). Alan says that while he is a fan of MMA, his love is with Brazilian Jiu Jitsu and he will always focus his energy on ground fighting and teaching Brazilian Jiu Jitsu as self-defense. Carlson Gracie Indianapolis Jiu Jitsu is new to the area but has exploded onto the scene.  It is one of Greenwood’s best kept secrets for Brazilian Jiu Jitsu training. Carlson Gracie Indianapolis Jiu Jitsu offers BJJ classes Monday through Saturday.  The school is located just ¼ mile from I65, so it is easily accessible from anywhere in Indy. The school offers a fundamentals and advanced class for adults.  The fundamentals class  introduces Brazilian Jiu Jitsu to the novice and helps the more advanced player sharpen up on the most important techniques in their games:  the basics.  The fundamentals class is taught from a curriculum that consists of 38 classes.  These classes are the foundation to anyone’s game.  They introduce technique, strategy, and teach players how to think. “One of the things that sets us apart from most other gyms is that the fundamentals here are taught as self-defense in a fight,"" says Stockman.  ""There are two types of Brazilian Jiu Jitsu:  there is 'sport' where you learn how to fight for points in tournaments, and 'self-defense' where you learn how to defend yourself from someone who is attacking you.  Jiu Jitsu was created as a self-defense thousands of years ago.  The sport side of it has really only been around for the last 20-25 years. Sport Jiu Jitsu is fun but should not be the foundation of your game."" Kids classes are offered 3 days a week. The Kids Classes are divided up into ages 4-8 and 9-14 and classes are catered to these age specific groups.  The younger kids learn BJJ through different games, drills, and technique.  The games are designed to teach them fundamental techniques but in a way that keeps their attention and allows them to have fund doing it.  ""At this age it is important for kids to enjoy the class first.  When they enjoy participating in the classes, the sky is the limit on what they are able to learn,"" says Stockman.  The older kids move through the adult Fundamental Curriculum but at a different pace than the adults.  Before training BJJ, Alan was an avid cyclist.  He competed all over the United States.  One of the things that he valued about cycling was the amount of time and dedication it took to properly prepare oneself to compete at a high level and be successful.­­­  “You could not go out there and fake it.  Either you were ready or you were not- there was no lying on the bike,” he said.  “We measured heart rates, calories, wattage output, speed, distances ridden, pedaling cadences, bike weight down to the ounce and we rode around with little computers to keep track of all of this.  We had coaches and mentors that would teach you how to eat, how to ride more efficiently, how to handle your bike, strategy, mechanics that would keep everything working and that would have you fitted on these high tech machines down to the millimeter… cycling was a complete science and was a great way to challenge yourself!  When I found Brazilian Jiu Jitsu, I found a lot of the same things in it that had drawn me into cycling before.  Instead of grinding out 2-3 hour daily rides we were hammering out techniques on the mat, trying to maximize our efficiency and movement, training our muscle memory and our minds as well.  The strategy and tactics in BJJ however, are at a level that I have never seen in any other sport.  It never ceases to amaze me how BJJ can stimulate your mind day in day out.  So BJJ to me is the complete mind and body experience.  Like cycling, I aim to keep myself in peak condition yet I am always able to challenge myself mentally.  Every day, no matter who I train with, whether it be a seasoned Black Belt or a first-day White Belt, I am able to challenge myself and grow."" “Another thing I love about the art of Brazilian Jiu Jitsu is the way people transform after training and it doesn’t take that long.  Physically, they lose weight, tone up, become more flexible, and as a result they have more energy, are much happier, and become more confident.  And they are learning how to defend themselves!  Martial Arts is very clichéd in that it promotes discipline, confidence, and so on but it does all of this time and time again.  So every day I get to  present and teach this great art of BJJ and I get to see how each person benefits from it.  I see this in adults, I see it in children, in guys and in girls.  Brazilian Jiu Jitsu is for everyone, it doesn’t care about age or gender.  It can benefit absolutely everyone!” says Alan. We offer a 7-day pass for anyone wanting to come in and check things out. Try it out for a week if you are not sure BJJ is for you. Make sure that Carlson Gracie Indianapolis Jiu Jitsu is a good fit for you.  We want everyone to be happy and to be learning Brazilian Jiu Jitsu. Give us a call or send us and email to see how you can get started and join the world renowned Carlson Gracie Team!  See you on the mats!";"http://www.carlsongracieindy.com/sites/all/themes/carlsongracie/logo.png";"http://www.carlsongracieindy.com/kids-martial-arts";"Welcome to the Carlson Gracie Jiu Jitsu Kid's and Teen program.  We are committed to providing a safe and fun learning environment where your child or teen can achieve their very best.  We offer tailored programs for different age groups, each with age appropriate curriculum geared to build a solid foundation for techniques that will continue to challenge and inspire our students. Effective methods become patterns of effective behavior in Jiu Jitsu training and ineffecitive techniques are discarded.  As a result, our students are constantly learning new techniques and perfecting old ones.  In our Kid's Program, we specialize in teaching children between the ages of 5 and 14. Your child or teen is welcome to try a complimentary class to experience firsthand the benefits of Brazilian Jiu Jitsu in building confidence, self-esteem and sportsmanship.  Research has shown that martial arts has resulted in boosting a child's ego, improving their grades, and giving them the mental and physical edge needed to excel for the rest of thier lives. We teach self-defense so that students will learn to defend themselves in any situation. Your children will learn to become high achievers in their lives. Jiu Jitsu is translated as ""The Gentle Art"" and though Jiu Jitsu they will learn that aggression is not always necessary. They will acquire skills of judgement that will result in being able to deduce right from wrong in a calm, authoritive manner. Through studying Jiu Jitsu they will learn that for every action there is a reaction and will begin to learn how to think ahead. Your child will take this skill into life and will learn how to act and react to everything that goes on around them analyzing situations with a calm, respectful outlook.  It is this attitude of respect for themselves and others that will lead them to become confident, self disciplined, super achievers! All of this with no mention of how much fun the classes are! I bring the same discipline and dedication that it has taken me to get my black belt in Jiu Jitsu into making sure that my classes are exciting, upbeat, and will result that your child will go home buzzing with a real sense of achievement.  At the same time, you get the benefit of knowing that your child is improving in many ways whether it be their health, confidence, or self discipline. Contact us today to find out how your teen or child can train the best Jiu Jitsu in Indianapolis and become a part of the Carlson Gracie Team!";;;;;"http://www.carlsongracieindy.com/schedule";;"Alan Stockman";"FREE 7-Day Pass for BJJ Classes!";"info@carlsongracieindy.com";"https://www.facebook.com/carlsongracieindy";"https://www.youtube.com/user/Indianapolisjiujitsu";"https://youtu.be/8AYVBl5BWqg";;1;634;
"10th Planet Jiu Jitsu Indianapolis";;(317) 589-0084;"6107 W Airport Blvd";"Greenfield";"IN";46140;;"United States";;;;;;;;;;;;;;"https://www.facebook.com/10PIndy/";;;;1;630;
"Indianapolis Jiu Jitsu Coach";"http://indianapolisbjjcoach.com/";(317) 538-5593;"4967 S Emerson Ave";"Indianapolis";"IN";46203;"5/5 Stars";"United States";"Brazilian Jiu Jitsu is a martial art that focuses on skill, leverage and mental awareness which allows a person to overcome a larger and stronger opponent. Brazilian Jiu Jitsu is a highly effective self-defense, a competitive sport and a core skill for Mixed Martial Arts (as in the UFC). Our BJJ Step-by-Step beginner courses are carefully structured and taught in a manner so that someone who is new to the art and/ or is totally out of shape can easily understand with out feeling overwhelmed or confused. The class will be with other beginners so the student will not feel out of place. The grappling and sparing is conducted under the utmost supervision to insure safety. Marcello's home academy in Indianapolis where he teaches Jiu Jitsu classes offers several different classes based on age and skill level so you can learn the art of BJJ and the right pace for you.";"http://indianapolisbjjcoach.com/images/logo.png";"http://indianapolisbjjcoach.com/why-join/kids";"A great activity for any child, male or female no matter their size, strength or skill level. Marcello's Indianpolis Jiu Jitsu Gym goals are to build the child's self-confidence, teach the importance of self-defense and instill discipline and respect all in a well-structured, supervised and fun class setting. Although it is the kids in the class, we understand enrollment is just as much the parent's. As a parent enrolling your child in martial arts, you will see many improvements in the first few lessons, both inside and outside of the academy. Through our Indianapolis Jiu Jitsu Coach's defense and value oriented curriculum kids will: Learn to defend themselves and protect against bullies; Increase in self-confidence and discipline; Develop concept of working hard towards goals;  Improved respect towards others. They learn these skills in a fun, yet structured, atmosphere. Brazilian Jiu Jitsu is an activity they can do their entire lives and at Marcello's Indianapolis Jiu Jitsu gym, we have classes accommodating every age group starting at 3 years old. Our children are taught to think 1, 2 or even 3 steps ahead of their opponent. This type of thinking leads to victories both on and off the mat, especially in possible defense situations. If you are interested in increasing your child's self-confidence, respect, discipline and self-defense skills, then fill out the form on the right to receive a free consultation and schedule time to see some of our classes.";"http://indianapolisbjjcoach.com/why-join/women";"Learn self-defense, improve your self-confidence and be healthier with Jiu Jitsu. Self Defense - BJJ - Violence towards females occurs every 6 seconds in the United States. If you were attacked today could you properly defend yourself? BJJ was created as a way for people to defend themselves against larger and stronger opponents. It teaches you to overcome an opponent or assailant by implementing proper use of technique and leverage while thinking 1, 2, 3 steps ahead of them. With Professor Marcello Monteiro's instruction you will learn how to take-down, control and submit your opponent while building the confidence and other skills needed to overcome a harmful situation. Health and Fitness - BJJ - Not only is Brazilian Jiu Jitsu great for self-defense, but it is an excellent activity to improve your health, burn fat and tone your body, while having fun and not even realizing you're working out. You will see improvements in the first few weeks to your weight, strength, stamina and balance just while practicing Brazilian Jiu Jitsu on a regular basis, no additional training needed! Brazilian Jiu Jitsu is a sport for everyone, no matter your shape, size, strength or athleticism. Learn Jiu Jitsu to defend yourself, get in shape, improve your health and have fun. In addition to learning all the tips and tricks while training in our academy with Marcello, you can also take advantage of the entire white-black belt professionally recorded, step-by-step curriculum which you can use to supplement your learning at the gym. The curriculum will help you speed up your journey to black belt and improve your overall game.";;;"http://indianapolisbjjcoach.com/schedule";;"Marcello C. Monteiro";;"mcmbjja@gmail.com";"https://www.facebook.com/Indianapolis-Jiu-Jitsu-Coach-Marcello-C-Monteiro-BJJ-Academy-239820432772769/";;;;1;631;
"Soma Jiu Jitsu of Kokomo";"http://www.graciekokomo.com";(765) 416-3453;"2320 Valentine Drive";"Kokomo";"IN";46902;;"United States";"Soma Jiu-Jitsu of Kokomo is run by head instructor James Horne, who is a Black Belt in Gracie Brazilian Jiu-Jitsu and official representative under Professor Matt Strack, who earned his black belt from 8th degree Master Pedro Sauer in 2006. At Soma Jiu-Jitsu of Kokomo we are dedicated to teaching the principles of Helio Gracie Jiu-Jitsu and preserving the integrity of the Martial Art, on and off of the mat. The mission of the academy is to provide quality instruction to our students through effective, real world self-defense techniques that are not based on size, strength, athletic ability or time limits. These techniques were proven as one of the most effective forms of self-defense in the first MMA competition in the United States during UFC 1 in 1993.  Jiu-Jitsu is also one of the earliest forms of exercise or physical fitness in existence, providing for a complete workout of the body and mind. At Soma Jiu-Jitsu of Kokomo, we are committed to improving the lives of our students and spreading the educational and moral benefits of the art. Each class is taught in the traditional white gi (uniform). Students must purchase a white gi before beginning class (not required for intro class)..";"http://www.graciekokomo.com/uploads/3/4/4/1/34416692/5811819_orig.jpg";;;;;;;"http://www.graciekokomo.com/schedule.html";"Tues, Thurs: 8:00pm-9:30pm, Sat: 8:30am-9:30am";"James Horne";;;"https://www.facebook.com/SomaJiuJitsuKokomo/";;;;0;639;
"Ribeiro Jiu Jitsu Academy South Bend";"https://southbendjj.com/";(574) 323-6459;"1520 Mishawaka Ave";"South Bend";"IN";46615;;"United States";"Our school is conveniently located in South Bend, Indiana and strives to provide the Michiana community with a safe, clean environment in which to learn the gentle art of Jiu-Jitsu. Experience the Jiu-Jitsu Lifestyle with the team at Ribeiro Jiu-Jitsu Academy of South Bend!";"https://i1.wp.com/southbendjj.com/wp-content/uploads/2017/08/rjj-affiliate-shield-silver-sign.png?w=155&ssl=1";;;;;;;"https://southbendjj.com/#schedule";;"Gary Briscoe";"Free Class";;"https://www.facebook.com/RJJASB/";"https://www.youtube.com/user/rjjasouthbend";"https://youtu.be/Ca0b-fU3Ito";;1;632;
"The Dragons Lair Academy";;(574) 312-0140;"229 S Michigan St";"South Bend";"IN";46601;;"United States";;;;;;;;;;;;;;;;;;1;633;"Closed"
"McVicker Brazilian Jiu Jitsu";"https://jackmcvicker.com/";(812) 460-0958;"2024 Wabash Ave";"Terre Haute";"IN";47807;;"United States";"Jack McVicker is a graduate of Indiana State University with a degree in criminology. Having trained in a number of different disciplines of martial arts since the age of 13, Jack has dedicated his life to teaching others and helping each person maximize his or her own unique skills and attributes so that his art works for them — on an individual basis. On a professional level, Jack is a 3rd degree Black Belt in the art of Brazilian Jiu Jitsu under legendary instructor Wellington “Megaton” Dias.  Jack is also certified by the International Brazilian Jiu Jitsu Federation (IBJJF).  Jack has been actively competing in Brazilian Jiu Jitsu for 20 years. He is 2013 World Jiu-Jitsu Champion.  At black belt level, he is a 5x Pan Jiu Jitsu Champion, 4x European Open Champion, 6x World No Gi Jiu Jitsu Champion, and 2x European No Gi Champion. In addition to BJJ, Jack is also certified in Bruce Lee’s art of Jeet Kune Do and Filipino Martial Arts (Kali) under legendary instructors Dan Inosanto and Paul Vunak. Jack still considers himself a student of martial arts. That helps to keep his passion alive for his students. Although Jack hones his skills by competing in tournaments, his strength and true passion is teaching others. While many martial arts instructors hold various jobs during the week and teach only in the evening or weekends, Jack makes his living teaching others. It is all he does, and it shows in his students –many of whom have won Jiu Jitsu Championships and Mixed Martial Arts belts";"http://jackmcvicker.com/wp-content/uploads/2014/10/logo1.gif";"http://jackmcvicker.com/programs/kids-programs/";"At McVicker’s Martial Arts Academy, experienced and dedicated instructors teach children effective self-defense skills based upon the martial arts of  Brazilian Jiu-Jitsu. Children also learn non-violent conflict resolution skills and bully- prevention tactics along with positive character traits that will help them to achieve in other areas of their lives. We offer classes that are fun and high-energy, providing exercise and motivation for children to lead healthy lifestyles.";;;"Jeet Kune Do";;;;"Jack McVicker";"Free Introductory Class";;;;;;0;638;
"Chute Boxe KC";"https://www.chuteboxekc.com/";(913) 280-0837;"735 Southwest Boulevard, Suite E";"Kansas City";"KS";66103;;"United States";"Chute Boxe KC brings to Kansas City the kind of hard core martial arts training that has developed some of the greatest fighters in the history of Muay Thai, Brazilian Jiu Jitsu, and Mixed Martial Arts.";"https://www.chuteboxekc.com/wp-content/uploads/2018/11/that-new-new-116935.png";"https://www.chuteboxekc.com/programs/";"Learning a martial art at a young age can have multiple benefits in a child’s life. Each class is an opportunity to practice focus and discipline as well as a great opportunity for exercise, or just to burn off a bit of energy. Self-defense and confidence are both major focuses for many of the classes to help a student handle physical altercations safely. BJJ is a great supplement to other team sports and usually can fit into even the busiest of schedules. ";;;"MMA, Fitness Boxing, Muay Thai, Youth Boxing, Power Hour and HIIT";;"https://www.chuteboxekc.com/schedule/";;"Claudio Popeye Mattos";"Free week trial";"info@chuteboxekc.com";"https://www.facebook.com/ChuteBoxeKC/";;;;1;654;
"American Top Team Kansas City";"https://americantopteamkc.com/";(913) 275-1097;"11227 Strang Line Rd";"Lenexa";"KS";66215;"5/5 Stars";"United States";"American Top Team HD is Kansas City’s most qualified source for Mixed Martial Arts fitness and instruction. Our gym offers classes in MMA, jiu-jitsu, boxing, muay thai and wrestling for all levels, kids and adults alike. Whether you’re an amateur or professional fighter looking to take your game to the next level or someone looking for a unique and fun way to stay in shape and meet people, there will be something for everyone here. We even have youth muay thai/kickboxing and jiu jitsu!";;"https://americantopteamkc.com/classes/youth-and-family-classes-at-atthd/";"Muay Thai/Kickboxing: Your child will love putting on gloves and learning to punch and kick the heavy bag or mits held by the instructor! They will learn simple, effective striking combinations along with other kickboxing fundamentals such as timing, rhythm, and balance. They will also develop speed, agility and strength using engaging and fun methods, such as relays and obstacle courses. Jiu-Jitsu: Jiu-jitsu is a martial art and self defense system that promotes the concept that a smaller, weaker person can successfully defend against a bigger, stronger assailant by using proper technique and leverage. Your child will learn basic jiu-jitsu techniques and the art of using leverage, skill and problem-solving to succeed regardless of size and weight!";;;"Muay Thai, Fitness Classes";;"https://americantopteamkc.com/schedule/";;"Jason High";;;"https://www.facebook.com/ATTKC";"https://www.youtube.com/channel/UCj5MzIZU4t8O1kfuDjx42lA";"https://youtu.be/WebJXZFYxxk";;1;649;
"Brazil Academy";"https://www.brazilacademyusa.com/";(913) 220-2153;"11441 S Strang Line Rd";"Lenexa";"KS";66215;"5/5 Stars";"United States";"The Brazil Academy was founded in 2010 by Ninja Pinto. Our family run establishment celebrates community, health, Brazilian culture, hard work, and family. Our classes are taught by world class instructors, and are suitable for beginning through advanced students. We routinely host guest clinicians from around the world to share their expertise and wisdom.";;"https://www.brazilacademyusa.com/kids";"Our Kids classes are not just a fun way to spend an afternoon.  Martial arts classes teach motor skills, character, strength, and confidence. Our programs give children a chance to learn together and experience a new language (Portuguese), music, and culture. Our students have the opportunity to participate in local and regional tournaments. We take great care and pride in teaching your children to be mentally and physically strong, all while having a great time! ";;;"Muay Thai, Capoeira, Ninja Bootcamp, Tai Chi, Music";;"https://www.brazilacademyusa.com/schedule";"Mon, Wed: 12:00pm-8:00pm; Tues, Thurs: 11:00am-8:00pm; Sat: 10:00am-4:00pm; Fri: Testing and Events Only";"Ninja Pinto";"One week of unlimited classes for just $29";;"https://www.facebook.com/BrazilAcademyUSA/";"https://www.youtube.com/channel/UCTshFaEhM1qFK4NnaQDbGjA";"https://youtu.be/F3-lSYIcFyg";;1;650;
