"name";"website";"phone";"address";"city";"state";"zip";"stars";"country";"details";"logo_url";"kids_program_url";"kids_program_detail";"woman_only_program_url";"woman_only_program_detail";"other_programs";"pricing";"schedule_url";"business_hour";"head_professor";"special_offer";"email";"facebook_url";"youtube_channel";"video_url";"awards";"multiple_locations (0=Yes, 1=No)";"id";"NOTES"
"Ohana Martial Arts";"http://ohanama.com/";(847) 338-5425;"995 Progress Drive, Unit 104";"Grayslake";"IL";60030;;"United States";"Ohana Martial Arts is dedicated to providing you and your family with a safe, friendly, and fun training experience. Whether you’re a beginner wanting to get fit, a child in need of confidence, or an experienced practitioner looking to take it to the next level, Ohana Martial Arts is right for you. Established in 2003, we are proud to be Lake County Illinois’ first BJJ Academy. For over 15 years, we have been committed to providing world-class instruction in a family friendly environment. We invite you to take your first step to GETTING IN SHAPE, RELIEVING STRESS, and gaining the CONFIDENCE that comes with being on the path to COMPLETE SELF-DEFENSE MASTERY.";"http://ohanama.com/wp-content/uploads/2019/02/ohanama-logo-header.png";"http://ohanama.com/kids-jiu-jitsu-2/";"Give your child the invaluable gift of personal empowerment. Your child will grow in confidence while learning bullyproof techniques that will make their school years more positive and enjoyable. A confident kid is a much happier kid. Our youth classes teach critical character and self-defense skills that will stay with your child into adulthood. In the Kid’s program we don’t just teach Jiu-Jitsu, we play the art of Jiu-Jitsu. Using a fun approach, we teach children basic self-defense techniques while instilling the all important fundamentals of leverage and control. Our goal is to make the lessons as much fun as they are educational, so that the children want to keep coming back. Students can begin this program at any time. Open to all levels.";;;"Striking";;"http://ohanama.com/class-schedule/";;"Christopher Lund";"The free trial class is an opportunity for you to experience our program first hand. After participating in your program of choice, there is no obligation to enroll, if you enjoyed the class and feel our Academy is right for you, then we can get you started.";;"https://www.facebook.com/martialartsgrayslake/";"https://www.youtube.com/channel/UCBnskoRwHUusy4zQiaX9bnA";"https://youtu.be/a7YO3SGyZx0";;0;;
"Roots Training Center";"http://www.rootstrainingcenter.com/";(224) 542-0691;"654 E State Rd.";"Island Lake";"IL";60042;;"United States";"Roots Training Center in Island Lake, IL is a Martial Arts gym for EVERYONE. We specialize in Striking (Boxing, Muay Thai, and MMA) & Brazilian Jiu-Jitsu, offering classes for all ages, levels, & fitness goals in an ego-free environment.";"http://www.rootstrainingcenter.com/images/Hero/Roots_ImageLogo_Black.svg";;"Kids classes at Roots Training Center focus on improving multiple skills along with technique and physical fitness. Kids (and parents) will also see improvements in motor skills, hand-eye coordination, social skills, language skills, and problem solving skills. The best part is, these skills go with them everywhere! Saying please and thank you is important both on and off the mats, as is an ability to stand up for yourself. Not to mention these skills (physical and mental) translate to every other sport, including wrestling, baseball, football, basketball, etc. Whatever your reason for training, we've got your kids covered!";;;"MMA, Boxing, Muay Thai, Wrestling, Kickboxing";;"http://www.rootstrainingcenter.com/class-schedule.html";;"Bob Hemmerich";"Free Trial Class";;"https://www.facebook.com/rootstrainingcenter/";;;;1;;
"Dekalb County Brazilian Jiu-Jitsu";"http://www.dekalbcountybjj.com/";(815) 900-6850;"210 W Lincoln Ave";"Hinckley";"IL";60520;;"United States";"We specialize in training people in Brazilian Jiu Jitsu from beginners to advanced in Chicago Il.  Proud members of Team Curran MMA Dekalb IL.  Brazilian Jiu Jitsu is heavily used in grappling MMA, and is very effective form of self defense.  We cover Dekalb IL, Elburn IL, St Charles IL, Geneva IL, Aurora IL, Hinckley IL, Waterman IL, Sugar Grove IL, and Plano IL Areas.  Jiu Jitsu is a great fitness tool and aids in weight loss.  Part of Pedro Sauer association.";;;;;;;;"http://www.dekalbcountybjj.com/schedule.html";;"Eric Hartwig";;;"https://www.facebook.com/Dekalb-County-BJJ-282584468597717/";"https://www.youtube.com/channel/UC7yeG73P3IcmLXdxY-tpkgQ";"https://youtu.be/ZUWMxjVL6Cg";;1;;
"LCCT BJJ Barrington";"https://www.lcctbjjbarrington.com/";(262) 378-2069;"730 S. Northwest Hwy, Suite 700";"Barrington";"IL";60010;;"United States";"Learn Brazilian Jiu-Jitsu from the best! Thiago Veiga and his Brother Luis Claudio learned Brazilian Jiu-Jitsu under Rickson Gracie. Thiago and Luis stared their journey in BJJ over 25 years ago. Falling in love with the gentle art, they decided to open their own academy to spread Rickson Gracie's philosophies across the USA. Thiago Veiga, a third degree black belt and also 2X World Champion. LCCT is a family, a support system that thrives off of one another's accomplishments. If you are looking for a home, then you are welcomed onto our mats. This is a growing family, with hundreds of people practicing LCCT BJJ techniques in 15 academies across the country. The kids program at LCCT can help your kids to individual development and personal growth, strength, self-awareness, respect, discipline and responsibility are common core values taught within our kids program. The program is structured to teach technique through functional games aimed to improve your child's agility and flexibility in a fun, friendly and interactive manner. Your kids will be learn with one of the best Jiu-Jitsu instructor of all time.";;;;;;;;"https://www.lcctbjjbarrington.com/classes";;"Thiago Veiga";;;"https://www.facebook.com/lcctbjjbarringtonIL/";;;;1;;
"Peoria Athletic Club - Peoria Heights";"http://www.peoriaathleticclub.org/";(309) 672-3090;"704 E War Memorial Dr";"Peoria Heights";"IL";61616;;"United States";"Structure Not Strength, Is What Makes Jiu-Jitsu Powerful.";"http://www.peoriaathleticclub.org/assets/img/sample2.png";;;;;"Boxing, Muay Thai Kickboxing";;"http://www.peoriaathleticclub.org/#schedule";;"Brad Peplow";;"pacmartialarts@gmail.com";;;;;1;;
"Peoria Athletic Club - Pekin";"http://www.peoriaathleticclub.org/";(309) 672-3090;"335 Sabella";"Pekin";"IL";61554;;"United States";"Structure Not Strength, Is What Makes Jiu-Jitsu Powerful.";"http://www.peoriaathleticclub.org/assets/img/sample2.png";;;;;"Boxing, Muay Thai Kickboxing";;"http://www.peoriaathleticclub.org/#schedule";;"Brad Peplow";;"pacmartialarts@gmail.com";;;;;1;;
"Tarpein's Dojo - Moline";"http://tarpeinsdojo.com/";(309) 764-4023;"2004 16th St";"Moline";"IL";61265;;"United States";"Travis Tarpein started schooling in the martial arts at an early age with his father, Nick Tarpein, learning the arts of karate, Brazilian Jiu-Jitsu and Muay Thai Kickboxing. Nick spent countless hours with Travis helping to hone him and his skills, including traveling to weekend tournaments to test Travis’ proficiency. With his strong foundation of hard work and determination, Travis always brought home trophies and medals for his victories. By age 17, Travis trained almost nonstop, holding high regard and having much respect for the discipline. After receiving his brown belt, Travis earned a position at Nick Tarpein’s School of Karate as a full-time instructor. Three and a half years later, just before his 21st birthday, Travis earned his black belt in the Shorei-Ryu system of Okinawan karate. Shortly thereafter, he was promoted to Manager of the Moline Nick Tarpein’s, and the school started to thrive under his management. Just before accepting his new managerial position, Travis had enrolled and started classes at Scott Community College with the intention to advance to Palmer College of Chiropractic. The opportunity then arose for Travis to purchase and become owner of the Moline Nick Tarpein’s, which forced him to make a hard decision between his passion, the martial arts, and his chiropractic education. Fortunate to all who have trained under his expertise, Travis chose to buy the school and dedicate his life to the martial arts. Sensei Travis Tarpein works diligently to give back to his students what was given to him by his father. As well as an outstanding instructor, Travis is still a martial arts student. He travels extensively learning at other dojo’s, bringing back his new found wisdom and sharing it with his students. Travis Tarpein is Iowa’s only Brazilian Jiu Jitsu black belt with the Carlson Gracie Team. His goal to become Iowa’s  and Quad Cities first legitimate Brazilian Jiu Jitsu Black Belt. This happened June 2012 and now has reached his first degree black belt in Brazilian Jiu Jitsu and also 6th degree master black belt in Shorei-Ryu. Travis still continues to train with Carlson Gracie Team and with Jeff Neal a 3 degree black belt with Carlson Gracie Jr. Sensei Tarpein has two academies and has dedicated himself to pass on his style of martial arts and Brazilian Jiu Jitsu to his students.";"http://tarpeinsdojo.com/wp-content/uploads/2014/01/map.png";"http://tarpeinsdojo.com/kids-self-defense/";"Kid’s class is fun, exciting, and most of all practical. At Tarpeins Martial Arts Center, your child will learn all ranges of self defense including “stand up” defense and “ground” defense. We do this by building a solid foundation of kicks, blocks, punches, Brazilian jiu jitsu and stretching. You will see your child grow in the dojo as well as out side the dojo with increased self esteem, self confidence and respect for others. Remember… martial arts is more than just self defense or sport, it can become a way of life.";;;"Shorei-Ryu Karate, Muay Thai Kickboxing, Judo/Sambo";;"http://tarpeinsdojo.com/school-info/schedule/";;"Travis Tarpein";;;"https://www.facebook.com/tarpeinsdojo/";"https://www.youtube.com/channel/UCY2b3UCpnHMzUh2GlG4lRxw";"https://youtu.be/w33Egi5KPug";;0;;
"SUDA International Training Center";"https://www.sudaitc.com/";(815) 272-1016;"13731 S. Route 30, Ste 109";"Plainfield";"IL";60544;;"United States";"SUDA International Training Center is an exclusive private martial arts academy dedicated to the growth of individuals through martial arts training and study. SUDA is the lead academy of Hill Brothers Team. Our mission is to provide top quality martial arts instruction, while positively impacting the citizens of our community. Instruction in Brazilian Jiu-Jitsu, Combat Jiu-Jitsu and Kickboxing provide the basis for our self-protection and competitive distinction.";"https://www.sudaitc.com/uploads/1/1/7/1/117175079/sitcsimplelogo_3.png";"https://www.sudaitc.com/youth.html";"Shin Kakuto Kickboxing teaches punching, kicking and throwing techniques that are effective in self-protection and competition. This class offers great martial arts and fitness. Most importantly, it is loads of fun. Our Authentic Brazilian Jiu-Jitsu program is a great combination of competition  and Self-Protection. Students learn techniques that empower even the smallest students to protect themselves.";;;"Kickboxing, ";;"https://www.sudaitc.com/schedule.html";"Mon, Wed: 5:00pm-8:30pm; Tues, Thurs: 8:30am-9:30am, 5:00pm-8:30pm";"Ron and James Hill";;;"https://www.facebook.com/SUDAITC%20/";"https://www.youtube.com/user/sudaintllp";"https://youtu.be/4a0c09WDhhY";;1;;
"Carlson Gracie Team MMA - Channahon";"http://www.carlsongracie-mma.com/";(312) 714-9329;"24230 Northern Illinois Drive";"Channahon";"IL";60410;;"United States";"We offer classes in Mixed Martial Arts, Boxing, Brazilian Jiu-Jitsu, Muay Thai Kickboxing, and Wrestling, as well as programs for kids. Our qualified instructors work with UFC fighters, military and law enforcement personnel, professional and amateur sport competitors, those interested in self defense, and people looking to get in great shape.";;;;;;"MMA, Boxing, Muay Thai Kickboxing, Wrestling";;"http://www.carlsongracie-mma.com/schedules/channahon-schedule/";;"Jeff Neal";;"info@carlsongracie-mma.com";"https://www.facebook.com/Carlson-Gracie-Team-Channahon-496165347087198/";;;;0;;
"Prime MuayThai MMA";"http://www.primemuaythai.com/";(630) 863-9531;"5100 Academy Drive, Suite 100";"Lisle";"IL";60532;;"United States";"MuayThai (Thai boxing), Brazilian Jiu-Jitsu (Carlson Gracie affiliated), Judo, Wrestling, and self defense. Kids and adults classes. Come train with us!";"http://www.primemuaythai.com/images/header_logo.png";;;;;"Muay Thai, Judo, Wrestling, Self-Defense";;"http://www.primemuaythai.com/timetable.html";"Mon-Thurs: 4:00pm-9:00pm, Fri: 3:00pm-9:00pm, Sat: 9:00am-2:00pm";"Sonny Ross";;"primemuaythai@gmail.com";"https://www.facebook.com/primemuaythai";;;;1;;
"Threshold Martial Arts";"https://thresholdmartialarts.com/";(847) 257-2210;"133 West Prospect Ave.";"Mount Prospect";"IL";60056;;"United States";"Started by Bill Shimuk over 10 years ago, Threshold Martial Arts programs focus on training local students in the arts of jiu jitsu, muay thai boxing, women’s kickboxing, and kids martial arts (jiu jitsu). The school offers classes 6 days a week and is open to students of all ages, sizes, and athletic abilities. One of the best things about the martial arts is that once you learn the fundamentals, you are then able to craft the martial arts to your strengths, weaknesses, and personality, becoming your own unique martial artist.";"https://thresholdmartialarts.com/wp-content/uploads/2018/11/threshold-martial-arts-gracie-academy-logo.jpg";"https://thresholdmartialarts.com/programs/kids-martial-arts/";"Recommended by the area’s top youth councilors, we offer kids martial arts for ages 4 to 14. At Threshold Martial Arts, our students are on a unique path, developing life and self-defense skills side by side. We focus on leadership development, problem-solving skills and understanding biomechanics resulting in true ability backed confidence for your child. Martial arts, especially kids jiu jitsu, is not just about learning how to kick and punch. Kids martial arts is about training our youth to be more confident, disciplined, and respectful, while also learning vital life skills. Self defense and problem solving skills are skills that our children will use for the rest of their life. Video games can’t teach these skills but a few hours on the mat with a great group of kids and instructors that are all working to improve their minds and bodies can have amazing results.";;;"Thai Boxing";;"https://thresholdmartialarts.com/schedule/";;"Bill Shimuk";;"info@thresholdmartialarts.com";"https://www.facebook.com/Threshold-Martial-Arts-Carlson-Gracie-148357805219552/";"https://www.youtube.com/user/thresholdma";"https://youtu.be/_5-QtZWH0b8";;1;;
"Carlson Gracie Team Lake Zurich";"https://www.carlsongracieteamlz.com/";(847) 899-3251;"100 Oakwood Rd., Unit H";"Lake Zurich";"IL";60047;;"United States";"We welcome people of all skill levels, ages, and genders at Carlson Gracie Team Lake Zurich";;;;;;;;"https://www.carlsongracieteamlz.com/schedule";;"David Downs";"1st Trial Class Is Free!";"carlsongracieteamlz@gmail.com";;;;;1;;
"Combat-Do Princeton";"https://combat-do.com/";(773) 698-0748;"413 S Main Street";"Princeton";"IL";61356;;"United States";"The school is 6000 square feet. It contains a complete men’s and woman’s locker room. There is a full regulation size boxing ring.  A very complete weight lifting area, complete with; dip bars, pull up bars, squat racks, bench presses, kettlebells, and dumbbells.  The school is fully matted with resilite wrestling mats and Swain throw bags.  We have nine heavy bags, three throwing dummies, and a dozen striking shields. The school has an extensive store with clothing and equipment for all your martial arts needs.";"https://combat-do.com/image/catalog/logo2.png";"https://combat-do.com/classes";"Combat-do offers multiple children’s classes for a fully developed and well-rounded martial artist.  The core and base principles are expressed through the following classes.  Children’s classes start at the age 3 and go up to 12 (unless the child is advanced or much larger than the other children).  Once they are of age, or are tapped to move up, they can begin attending the adult classes. The Combat-Do Tiny Tots and Children’s programs build a foundation of skill and mental toughness during the crucial early years of child development. Of course, we acknowledge that child athletes must not be pushed as hard as adults. At the halfway point of children’s and tots’ classes, the students get a water break for ten minutes. During this time they receive a lecture on the philosophical and moral side of the martial arts. These discussions cover a variety of topics, but only one per class. Some subjects discussed include anti-bullying, ethics, street safety, situational awareness, leadership traits, and principles. These lectures are crucial to the development of any young martial artist and we believe strongly that they are valuable for any child.";;;"MMA, Judo, Wrestling, Submission Grappling, Boxing, Muay Thai, Kickboxing, Low Kick";"1 Month Single Child $135.00; 1 Month Single Teen/Adult $165.00; 1 Year Contract Child $110.00; 1 Year Contract Teen/Adult $135.00 ";"https://combat-do.com/class-schedule";;"Bob Schirmer";;;"https://www.facebook.com/combatdoprinceton/";;;;0;;
"Muncie Brazilian Jiu Jitsu";"http://munciebjj.com/";(765) 228-2284;"4709 Wheeling Ave";"Muncie";"IN";47304;;"United States";"Muncie Brazilian Jiu Jitsu is committed to providing high quality Brazilian Jiu Jitsu instruction to a diverse group of individuals with a variety of achievement goals.  We are dedicated to creating an exciting, challenging, welcoming, and family friendly environment for all who wish to learn this wonderful martial art. At Muncie Brazilian Jiu Jitsu we are aware that every individual has his or her own reasons for searching for a quality martial arts training program.  Whether you are looking for self defense, a competitive outlet, to improve your physical fitness and self confidence, or you are trying to find an exciting new activity we are here to help you achieve your goals.  We believe that Jiu Jitsu is a martial art for everyone, regardless of your age, current level of physical fitness, or experience level.  It is our belief that diversity of students, physical capabilities, life experiences, and motivations for participating in a martial arts program help foster a unique and positive learning environment.";;"http://munciebjj.com/classes/";"Our kids’ program is open to children ages 6 to 13. We want your child to have fun, set and achieve goals, build their self-esteem and self-confidence, improve their self discipline, and create healthy habits that will serve them throughout their entire lives. Kids’ Class will generally mirror the curriculum of our Fundamentals I class with the addition of more takedowns and more work on the self-defense aspects of Brazilian Jiu Jitsu. We believe that self defense should be the central focus of any children's martial arts program. With rising concern about bullying, we want your child to have the confidence to carry themselves in a way that will discourage their peers from making them the target of bullying.";;;;;"http://munciebjj.com/schedule/";;"Max Burt";"Free seven day pass";;"https://www.facebook.com/Muncie-Brazilian-Jiu-Jitsu-120739958014510/";;;;1;;
"Big Gorilla Brazilian Jiu-Jitsu";"https://www.biggorillabjj.com/";(317) 405-8996;"5002 Madison Avenue";"Indianapolis";"IN";46227;;"United States";"Professor Cody began his martial arts training in 2004. He received his Blue Belt (Faixa Azul) in BJJ (Brazilian Jiu-Jitsu) in 2007.  In 2012, he received his Purple Belt (Faixa Roxa) in BJJ. In 2015 he achieved the rank of Brown Belt (Faixa Marrom). In 2017, Professor Cody became the first American to be promoted to Black Belt (Faixa Preta) by 2x World Champion Professor Guybson Sa. Lineage: Takeo Iano > Francisco Sá > Guybson Sa > Cody Miller";"https://static.wixstatic.com/media/610781_7819fbf64ebe40a29e46c75dcba8e080~mv2.jpg/v1/fill/w_360,h_361,al_c,q_80/43400868_319096558641937_533709757658588.webp";;;;;;;"https://www.biggorillabjj.com/schedule";;"Cody Miller";;;"https://www.facebook.com/biggorillabjj/";"https://www.youtube.com/channel/UCGED8D8WY7E4LiUJVXT9Amw";"https://youtu.be/ZaULbXMq1Jo";;1;;
"Fishers Brazilian Jiu-Jitsu and Boxing";"http://fishersbrazilianjiujitsu.com/";(317) 397-8747;"13017 Parkside Dr";"Fishers";"IN";46038;;"United States";"Fishers Brazilian Jiu-Jitsu and Boxing is the premier boxing, kickboxing, Brazilian Jiu-Jitsu, and Mixed Martial Arts gym in northern Indianapolis. Located in Fishers, Indiana, we stress the importance of commitment and goal-oriented training to maximize results and keep students motivated. We provide students with professional coaches and realistic training to teach that age and size can be overcome. We understand that not everyone dreams of being a fighter or competing. Our curriculum is designed so that all skills and concepts can be applied inside and outside the cage. The ultimate goal of all our coaches is to provide students with the necessary information and abilities to protect themselves no matter the situation.";"http://fishersbrazilianjiujitsu.com/wp-content/uploads/2015/12/tmpLogo2.png";;;;;"Boxing, Kickboxing, K2 Cardio Kickboxing, ";;"http://fishersbrazilianjiujitsu.com/schedule/";;"Jason Kesler";;"fishersbjj@gmail.com";"https://www.facebook.com/Fishers-BJJ-Boxing-169796049719330/";;;;1;;
"Barrick Brazilian Jiu Jitsu";"http://barrickbjj.com/";(574) 538-1703;"320 N Chicago Ave., Suite 10";"Goshen";"IN";46526;;"United States";"Barrick Brazilian Jiu Jitsu is Goshen’s first Brazilian Jiu Jitsu school. Head instructor and first-degree black belt Bryan Barrick has been teaching the martial art in the area since 1998, shortly after conducting the first tournament in Northern Indiana.";"http://barrickbjj.com/wp-content/uploads/2016/01/modified-logo-2.png";"http://barrickbjj.com/kids-classes/";"Our Kids program focuses on teaching our students jiu jitsu in a safe, rewarding environment in which personal growth and technical improvement are encouraged. Besides learning jiu jitsu, we teach our students discipline, respect for others and the importance of healthy living. Children will learn self-defense techniques, build confidence and self-discipline. In turn, they will be less likely to become victims of bullies or become a bully themselves. We treat all our students the same, working with them to realize their full potential and help them to grow both on and off the mat. We work closely with parents. Parents should feel free to discuss with us anything regarding your child. We encourage communication between us, students and their parent/guardian. Because we understand that not every student learns or advances at the same pace as others, each student is given a set of required techniques and skills that must be developed to advance in rank. Each student will then be tested after a 6 to 8 week period to prove not only knowledge but the application of techniques.";;;"Boxing";;"http://barrickbjj.com/schedule/";;"Bryan Barrick";"Free Class";;"https://www.facebook.com/barrickbjj/";"https://www.youtube.com/user/mykel2com/";"https://youtu.be/wRcvOK0Si0s";;1;;
"Endurance Training Center Brazilian Jiu-Jitsu";"https://www.endurancebjj.com/";(317) 374-0051;"5078 W 106th St";"Zionsville";"IN";46077;;"United States";"Endurance Training Center Brazilian Jiu-Jitsu is the premier Zionsville center for Indianapolis Jiu-Jitsu for Kids and Adults.";"https://3wag8w3385wm4bqa7h3x42ta-wpengine.netdna-ssl.com/wp-content/uploads/2018/07/Endurance-BJJ-Logo-FINAL-300x300.png";;;;;;;"https://www.endurancebjj.com/endurance-training-center-bjj-class-schedule/";;"Mat Stratta";"Free 30 Day Trial";"mat@endurancebjj.com";"https://www.facebook.com/EnduranceTrainingCenterBrazilianJiuJitsu/";"https://www.youtube.com/user/EnduranceBJJ";"https://youtu.be/jgHBIMmWego";;1;;
"Journey Brazilian Jiu-Jitsu - Main Academy";"http://www.journeybjj.co/";(260) 358-6088;"204 E Main St Lm";"North Manchester";"IN";46962;;"United States";"Journey Brazilian Jiu-Jitsu Academy LLC  was established in May 2015.  We have an open door policy and always welcome new guests to our Academy regardless of team or affiliation.  Our mission is to provide each student with quality instruction in the art of Traditional Brazilian Jiu-Jitsu (BJJ), Nogi/MMA Grappling, Wrestling, Cardio Kickboxing, Taekwondo, and Kids BJJ,  within a friendly,  clean, state of the art, and professional atmosphere.";;"http://www.journeybjj.co/kids-bjj.html";;"http://www.journeybjj.co/womens-self-defense.html";;"MMA, Cardio Kickboxing, Taekwondo";"Unlimited Brazilian Jiu-Jitsu: $70, Kids BJJ: $40, Cardio Kickboxing: $30";"http://www.journeybjj.co/class-schedule.html";;"Chris Hubartt";"We now offer 30 days of FREE Classes, FREE T-Shirt, and a FREE Private lesson, to all New Brazilian Jiu-Jitsu Students";"chris.hubartt@live.com";"https://www.facebook.com/journeybrazilianjiujitsu";;;;0;;
